<?xml version="1.0" ?>
<!DOCTYPE model SYSTEM "eol.dtd">
<!--
     $Id: datatypes.xml 1438 2008-04-26 00:04:29Z labsky $
     Definition of generic token patterns used to to extract values having a certain datatype
-->
<model>
<datatypes>

 <!-- textual -->
 <pattern id="name">
   <tok />{1,10}
 </pattern>
 <pattern id="text">
   <tok />{1,200}
 </pattern>
 <pattern id="xml">
   <tok />{1,200}
 </pattern>
  
 <!-- numbers -->
 <pattern id="int">
   <tok type="INT"/>+
 </pattern>
 <pattern id="float">
   <tok type="INT"/>+ (.|,) <tok type="INT"/>+
   <tok type="INT"/>* <tok type="FLOAT"/>
 </pattern>
 
 <!-- boolean -->
 <pattern id="bool" ignore="case">
   yes | y | true | 1 | ano | a
   no | n | n.a. | n/a | none | false | 0 | ne
 </pattern>
 
 <!-- time -->
 <pattern id="minutes">
 00|01|02|03|04|05|06|07|08|09|10|11|12|13|14|15|16|17|18|19
 20|21|22|23|24|25|26|27|28|29|30|31|32|33|34|35|36|37|38|39
 40|41|42|43|44|45|46|47|48|49|50|51|52|53|54|55|56|57|58|59
 </pattern>
 <pattern id="hours">
 01|02|03|04|05|06|07|08|09|10|11|12|13|14|15|16|17|18|19|20|21|22|23
 1|2|3|4|5|6|7|8|9
 </pattern>
 <pattern id="time">
   <pattern ref="hours"/> (:|.|-)? <pattern ref="minutes"/>
 </pattern>
 
 <!-- date -->
 <pattern id="day">
 1|2|3|4|5|6|7|8|9|10|11|12|13|14|15|16|17|18|19|20|21|22|23|24|25|26|27|28|29|30|31
 1st|2nd|3rd|4th|5th|6th|7th|8th|9th|10th|11th|12th|13th|14th|15th|16th|17th|18th|19th|20th|21st|22nd|23rd|24th|25th|26th|27th|28th|29th|30th|31st
 </pattern>
 <pattern id="day_name" ignore="case">
  monday|tuesday|wednesday|thursday|friday|saturday|sunday
  (mon|tue|wed|thu|fri|sat|sun) .?
 </pattern>
 <pattern id="month" ignore="case">
 1|jan|january
 2|feb|february
 3|mar|march
 4|apr|april
 5|may
 6|jun|june
 7|jul|july
 8|aug|august
 9|sep|september
 10|oct|october
 11|nov|november
 12|dec|december
 </pattern>
 <pattern id="year">
 1950|1951|1952|1953|1954|1955|1956|1957|1958|1959|1960|1961|1962|1963|1964|1965
 1966|1967|1968|1969|1970|1971|1972|1973|1974|1975|1976|1977|1978|1979|1980|1981
 1982|1983|1984|1985|1986|1987|1988|1989|1990|1991|1992|1993|1994|1995|1996|1997
 1998|1999|2000|2001|2002|2003|2004|2005|2006|2007|2008|2009|2010|2011|2012|2013
 2014|2015|2016|2017|2018|2019|2020|2021|2022|2023|2024|2025|2026|2027|2028|2029
 2030|2031|2032|2033|2034|2035|2036|2037|2038|2039|2040|2041|2042|2043|2044|2045
 2046|2047|2048|2049|2050
 80|81|82|83|84|85|86|87|88|89|90|91|92|93|94|95|96|97|98|99|00|01|02|03|04|05|06|07|08|09
 </pattern>
 <pattern id="date">
   <pattern ref="day"/> (.|/|-) <pattern ref="month"/> ((.|/|-)? <pattern ref="year"/>)?
   <pattern ref="month"/> (.|/|-)? <pattern ref="year"/>
   (<pattern ref="year"/> (/|-))? <pattern ref="month"/> (/|-) <pattern ref="day"/>
   <pattern ref="year"/> (/|-) <pattern ref="month"/>
 </pattern>

</datatypes>
</model>
